[
  {
    "src_ip": "8.8.8.8",
    "dst_ip": "10.0.0.10",
    "src_port": 40123,
    "dst_port": 443,
    "protocol": "tcp",
    "packets": 12,
    "bytes": 2048,
    "start_ts": "2026-01-01T00:00:00Z",
    "end_ts": "2026-01-01T00:00:05Z",
    "tags": ["external_ingress"],
    "app_hint": "https"
  }
]
